{
  "$schema": "https://json-schema.org/draft/2020-12/schema",
  "type": "object",
  "required": [
    "schema_version",
    "summary",
    "trigger",
    "inputs",
    "steps",
    "idempotency",
    "retries",
    "credentials",
    "observability",
    "manual_override",
    "state_model",
    "compensation",
    "concurrency",
    "timeout_policy",
    "traceability"
  ],
  "properties": {
    "schema_version": {
      "type": "string",
      "const": "1.0"
    },
    "summary": {
      "type": "string",
      "minLength": 1
    },
    "trigger": {
      "type": "string",
      "minLength": 1
    },
    "inputs": {
      "type": "array",
      "items": {},
      "minItems": 0
    },
    "steps": {
      "type": "array",
      "items": {
        "type": "object",
        "required": [
          "id",
          "action",
          "success",
          "failure"
        ],
        "properties": {
          "id": {
            "type": "string",
            "minLength": 1
          },
          "action": {
            "type": "string",
            "minLength": 1
          },
          "success": {
            "type": "string",
            "minLength": 1
          },
          "failure": {
            "type": "string",
            "minLength": 1
          }
        },
        "additionalProperties": true
      },
      "minItems": 1
    },
    "idempotency": {
      "type": "string",
      "minLength": 1
    },
    "retries": {
      "type": "string",
      "minLength": 1
    },
    "credentials": {
      "type": "array",
      "items": {
        "type": "string",
        "minLength": 1
      },
      "minItems": 0
    },
    "observability": {
      "type": "array",
      "items": {
        "type": "string",
        "minLength": 1
      },
      "minItems": 0
    },
    "manual_override": {
      "type": "string",
      "minLength": 1
    },
    "state_model": {
      "type": "array",
      "items": {
        "type": "object",
        "required": [
          "state",
          "entry",
          "exit"
        ],
        "properties": {
          "state": {
            "type": "string",
            "minLength": 1
          },
          "entry": {
            "type": "string",
            "minLength": 1
          },
          "exit": {
            "type": "string",
            "minLength": 1
          },
          "on_error": {
            "type": "string",
            "minLength": 1
          }
        },
        "additionalProperties": true
      },
      "minItems": 1
    },
    "compensation": {
      "type": "string",
      "minLength": 1
    },
    "concurrency": {
      "type": "string",
      "minLength": 1
    },
    "timeout_policy": {
      "type": "string",
      "minLength": 1
    },
    "traceability": {
      "type": "array",
      "items": {
        "type": "object",
        "required": [
          "requirement",
          "workflow_step"
        ],
        "properties": {
          "requirement": {
            "type": "string",
            "minLength": 1
          },
          "workflow_step": {
            "type": "string",
            "minLength": 1
          },
          "evidence": {
            "type": "string",
            "minLength": 1
          }
        },
        "additionalProperties": true
      },
      "minItems": 1
    }
  },
  "additionalProperties": true,
  "title": "OpenAppForge workflow_spec"
}
